[
  {
    "id": "chinese-001",
    "subject": "chinese",
    "type": "multiple_choice",
    "question": "Which word has the same initial consonant as the underlined part of 'think'?",
    "options": ["A. those", "B. thank", "C. they", "D. there"],
    "answer": "B",
    "answer_type": "letter",
    "scoring": { "max_points": 1, "method": "exact" },
    "source": "2022 Beijing Zhongkao",
    "difficulty": "easy",
    "notes": ""
  },
  {
    "id": "chinese-002",
    "subject": "chinese",
    "type": "multiple_choice",
    "question": "In the sentence 'The book ___ on the table belongs to me', the correct verb is:",
    "options": ["A. lie", "B. lays", "C. lying", "D. laid"],
    "answer": "C",
    "answer_type": "letter",
    "scoring": { "max_points": 1, "method": "exact" },
    "source": "2021 Shanghai Zhongkao",
    "difficulty": "medium",
    "notes": ""
  },
  {
    "id": "chinese-003",
    "subject": "chinese",
    "type": "multiple_choice",
    "question": "Which of the following classical Chinese idioms means 'to do redundant work'?",
    "options": ["A. draw a snake and add feet", "B. wait for a rabbit by a stump", "C. plug ears while stealing a bell", "D. mend the fold after sheep are lost"],
    "answer": "A",
    "answer_type": "letter",
    "scoring": { "max_points": 1, "method": "exact" },
    "source": "2023 Guangdong Zhongkao",
    "difficulty": "medium",
    "notes": "English translation of 画蛇添足"
  },
  {
    "id": "chinese-004",
    "subject": "chinese",
    "type": "multiple_choice",
    "question": "Which figure of speech is used in 'My love is like a red, red rose'?",
    "options": ["A. metaphor", "B. simile", "C. personification", "D. hyperbole"],
    "answer": "B",
    "answer_type": "letter",
    "scoring": { "max_points": 1, "method": "exact" },
    "source": "2020 Jiangsu Zhongkao",
    "difficulty": "easy",
    "notes": ""
  },
  {
    "id": "chinese-005",
    "subject": "chinese",
    "type": "multiple_choice",
    "question": "In the poem 'Quiet Night Thought' (Jing Ye Si) by Li Bai, the poet looks up at the bright moon and then looks down to think of:",
    "options": ["A. his friends", "B. his hometown", "C. his ruler", "D. the coming winter"],
    "answer": "B",
    "answer_type": "letter",
    "scoring": { "max_points": 1, "method": "exact" },
    "source": "2019 Classical poetry Zhongkao",
    "difficulty": "easy",
    "notes": ""
  },
  {
    "id": "chinese-006",
    "subject": "chinese",
    "type": "short_answer",
    "question": "Explain in one sentence the meaning of the idiom 'staying by a stump waiting for a hare' (shou zhu dai tu).",
    "answer": "To rely on luck or past accidental success instead of active effort.",
    "answer_type": "text",
    "scoring": {
      "max_points": 2,
      "method": "rubric",
      "rubric": [
        { "criterion": "mentions reliance on luck or chance", "points": 1 },
        { "criterion": "contrasts with active effort or hard work", "points": 1 }
      ]
    },
    "source": "2022 Zhejiang Zhongkao",
    "difficulty": "medium",
    "notes": "accept: trusting to chance; not working"
  },
  {
    "id": "chinese-007",
    "subject": "chinese",
    "type": "short_answer",
    "question": "Identify the rhetorical device in 'The wind sang through the trees' and explain its effect in one sentence.",
    "answer": "Personification; it makes the wind seem alive and creates a vivid, emotional atmosphere.",
    "answer_type": "text",
    "scoring": {
      "max_points": 2,
      "method": "rubric",
      "rubric": [
        { "criterion": "identifies personification", "points": 1 },
        { "criterion": "explains vividness or emotional effect", "points": 1 }
      ]
    },
    "source": "2021 Hubei Zhongkao",
    "difficulty": "medium",
    "notes": ""
  },
  {
    "id": "chinese-008",
    "subject": "chinese",
    "type": "short_answer",
    "question": "Write a one-sentence summary of the main idea of Lu Xun's essay 'From Baicao Garden to Sanwei Study'.",
    "answer": "The essay recalls the author's free, joyful childhood play in the garden and contrasts it with the disciplined, restrictive life of study.",
    "answer_type": "text",
    "scoring": {
      "max_points": 3,
      "method": "rubric",
      "rubric": [
        { "criterion": "mentions joyful or free childhood play in the garden", "points": 1 },
        { "criterion": "mentions the study or school setting", "points": 1 },
        { "criterion": "states the contrast between the two", "points": 1 }
      ]
    },
    "source": "2020 Beijing Zhongkao",
    "difficulty": "hard",
    "notes": ""
  },

  {
    "id": "math-001",
    "subject": "math",
    "type": "multiple_choice",
    "question": "Simplify (x+2)(x-2).",
    "options": ["A. x^2-4", "B. x^2+4", "C. x^2-2x", "D. x^2-4x+4"],
    "answer": "A",
    "answer_type": "letter",
    "scoring": { "max_points": 1, "method": "exact" },
    "source": "2023 Beijing Zhongkao Q15",
    "difficulty": "easy",
    "notes": ""
  },
  {
    "id": "math-002",
    "subject": "math",
    "type": "multiple_choice",
    "question": "If 2x + 3 = 11, then x = ?",
    "options": ["A. 3", "B. 4", "C. 5", "D. 6"],
    "answer": "B",
    "answer_type": "letter",
    "scoring": { "max_points": 1, "method": "exact" },
    "source": "2022 Shanghai Zhongkao",
    "difficulty": "easy",
    "notes": ""
  },
  {
    "id": "math-003",
    "subject": "math",
    "type": "multiple_choice",
    "question": "What is the value of sin 30 degrees?",
    "options": ["A. 0", "B. 1/2", "C. sqrt(2)/2", "D. sqrt(3)/2"],
    "answer": "B",
    "answer_type": "letter",
    "scoring": { "max_points": 1, "method": "exact" },
    "source": "2023 Guangdong Zhongkao",
    "difficulty": "medium",
    "notes": "accept: 0.5"
  },
  {
    "id": "math-004",
    "subject": "math",
    "type": "multiple_choice",
    "question": "The discriminant of x^2 + 2x + 5 = 0 is:",
    "options": ["A. 0", "B. 4", "C. -16", "D. 21"],
    "answer": "C",
    "answer_type": "letter",
    "scoring": { "max_points": 1, "method": "exact" },
    "source": "2021 Zhejiang Zhongkao",
    "difficulty": "medium",
    "notes": ""
  },
  {
    "id": "math-005",
    "subject": "math",
    "type": "short_answer",
    "question": "Solve the equation 3x - 7 = 2x + 5 for x. Show your steps.",
    "answer": "x = 12",
    "answer_type": "text",
    "scoring": {
      "max_points": 3,
      "method": "rubric",
      "rubric": [
        { "criterion": "moves variable terms to one side (3x minus 2x)", "points": 1 },
        { "criterion": "moves constants to the other side (5 plus 7)", "points": 1 },
        { "criterion": "correct final answer x equals 12", "points": 1 }
      ]
    },
    "source": "2022 Jiangsu Zhongkao",
    "difficulty": "easy",
    "notes": ""
  },
  {
    "id": "math-006",
    "subject": "math",
    "type": "short_answer",
    "question": "Factor x^2 - 5x + 6 completely.",
    "answer": "(x-2)(x-3)",
    "answer_type": "text",
    "scoring": {
      "max_points": 2,
      "method": "rubric",
      "rubric": [
        { "criterion": "finds correct roots 2 and 3", "points": 1 },
        { "criterion": "writes correct factor form (x minus 2)(x minus 3)", "points": 1 }
      ]
    },
    "source": "2023 Sichuan Zhongkao",
    "difficulty": "medium",
    "notes": "accept reordered factors"
  },
  {
    "id": "math-007",
    "subject": "math",
    "type": "short_answer",
    "question": "A right triangle has legs of length 3 and 4. Find the length of the hypotenuse.",
    "answer": "5",
    "answer_type": "text",
    "scoring": {
      "max_points": 2,
      "method": "rubric",
      "rubric": [
        { "criterion": "applies Pythagorean theorem (3 squared plus 4 squared equals c squared)", "points": 1 },
        { "criterion": "correct answer 5", "points": 1 }
      ]
    },
    "source": "2021 Anhui Zhongkao",
    "difficulty": "easy",
    "notes": "accept: sqrt(25); 5.0"
  },
  {
    "id": "math-008",
    "subject": "math",
    "type": "short_answer",
    "question": "Solve the system: x + y = 7 and x - y = 1. State both x and y.",
    "answer": "x = 4, y = 3",
    "answer_type": "text",
    "scoring": {
      "max_points": 3,
      "method": "rubric",
      "rubric": [
        { "criterion": "uses addition or subtraction method correctly", "points": 1 },
        { "criterion": "correct x equals 4", "points": 1 },
        { "criterion": "correct y equals 3", "points": 1 }
      ]
    },
    "source": "2020 Henan Zhongkao",
    "difficulty": "medium",
    "notes": "accept either order"
  },

  {
    "id": "english-001",
    "subject": "english",
    "type": "multiple_choice",
    "question": "Choose the correct article: I saw ___ elephant at the zoo.",
    "options": ["A. a", "B. an", "C. the", "D. (no article)"],
    "answer": "B",
    "answer_type": "letter",
    "scoring": { "max_points": 1, "method": "exact" },
    "source": "2023 Beijing Zhongkao",
    "difficulty": "easy",
    "notes": ""
  },
  {
    "id": "english-002",
    "subject": "english",
    "type": "multiple_choice",
    "question": "Which sentence is grammatically correct?",
    "options": [
      "A. She don't like coffee.",
      "B. She doesn't likes coffee.",
      "C. She doesn't like coffee.",
      "D. She not like coffee."
    ],
    "answer": "C",
    "answer_type": "letter",
    "scoring": { "max_points": 1, "method": "exact" },
    "source": "2022 Guangdong Zhongkao",
    "difficulty": "easy",
    "notes": ""
  },
  {
    "id": "english-003",
    "subject": "english",
    "type": "multiple_choice",
    "question": "Choose the synonym of 'happy':",
    "options": ["A. sad", "B. angry", "C. joyful", "D. tired"],
    "answer": "C",
    "answer_type": "letter",
    "scoring": { "max_points": 1, "method": "exact" },
    "source": "2021 Shanghai Zhongkao",
    "difficulty": "easy",
    "notes": ""
  },
  {
    "id": "english-004",
    "subject": "english",
    "type": "multiple_choice",